{
  "$schema": "https://json-schema.org/draft/2020-12/schema",
  "$id": "urn:pointr:contracts:report",
  "title": "report.json",
  "description": "DATA_CONTRACTS.md section 8. Every measurement is {value, unit}; a null value carries a reason. Counts are plain integers named n_*.",
  "type": "object",
  "additionalProperties": false,
  "required": [
    "contract_version", "run_id", "session_id", "camera_id", "group_id", "generated_at",
    "court", "positions", "params", "session", "tracks", "caveats"
  ],
  "properties": {
    "contract_version": {"type": "string", "pattern": "^(0|[1-9][0-9]*)\\.(0|[1-9][0-9]*)\\.(0|[1-9][0-9]*)$"},
    "run_id": {"$ref": "#/$defs/uuid4"},
    "session_id": {"$ref": "#/$defs/uuid4"},
    "camera_id": {"type": ["string", "null"], "pattern": "^[A-Za-z0-9_-]{1,32}$"},
    "group_id": {"type": ["string", "null"], "pattern": "^[A-Za-z0-9_-]{1,64}$"},
    "generated_at": {"$ref": "#/$defs/utc"},
    "court": {
      "type": ["object", "null"],
      "additionalProperties": false,
      "required": ["type", "length_m", "width_m"],
      "properties": {
        "type": {"enum": ["fiba_full", "fiba_half", "custom"]},
        "length_m": {"type": "number", "exclusiveMinimum": 0},
        "width_m": {"type": "number", "exclusiveMinimum": 0}
      }
    },
    "positions": {
      "type": "object",
      "additionalProperties": false,
      "required": ["unit", "point", "calibrated", "calibration_id", "check_error_m"],
      "properties": {
        "unit": {"type": "string", "minLength": 1},
        "point": {"const": "bottom_centre"},
        "calibrated": {"type": "boolean"},
        "calibration_id": {"anyOf": [{"$ref": "#/$defs/uuid4"}, {"type": "null"}]},
        "check_error_m": {"type": ["number", "null"], "minimum": 0}
      }
    },
    "params": {
      "type": "object",
      "additionalProperties": false,
      "required": [
        "max_gap", "smooth_window", "min_valid_intervals", "short_track", "stationary_below",
        "walking_below"
      ],
      "properties": {
        "max_gap": {"$ref": "#/$defs/quantity"},
        "smooth_window": {"$ref": "#/$defs/quantity"},
        "min_valid_intervals": {"$ref": "#/$defs/quantity"},
        "short_track": {"$ref": "#/$defs/quantity"},
        "stationary_below": {"$ref": "#/$defs/quantity"},
        "walking_below": {"$ref": "#/$defs/quantity"}
      }
    },
    "session": {
      "type": "object",
      "additionalProperties": false,
      "required": [
        "status", "detection", "duration", "n_captured", "n_processed", "n_dropped",
        "n_unprocessed", "processed_fps", "drop_rate", "coverage", "n_tracks", "n_short_tracks",
        "frame_interval_median", "frame_interval_max", "app_delay_p50", "app_delay_p95",
        "app_delay_max", "events"
      ],
      "properties": {
        "status": {"enum": ["running", "ended", "interrupted", "error"]},
        "detection": {"type": "boolean"},
        "duration": {"$ref": "#/$defs/quantity"},
        "n_captured": {"type": ["integer", "null"], "minimum": 0},
        "n_processed": {"type": "integer", "minimum": 0},
        "n_dropped": {"type": ["integer", "null"], "minimum": 0},
        "n_unprocessed": {"type": ["integer", "null"], "minimum": 0},
        "processed_fps": {"$ref": "#/$defs/quantity"},
        "drop_rate": {"$ref": "#/$defs/quantity"},
        "coverage": {"$ref": "#/$defs/quantity"},
        "n_tracks": {"type": "integer", "minimum": 0},
        "n_short_tracks": {"type": "integer", "minimum": 0},
        "frame_interval_median": {"$ref": "#/$defs/quantity"},
        "frame_interval_max": {"$ref": "#/$defs/quantity"},
        "app_delay_p50": {"$ref": "#/$defs/quantity"},
        "app_delay_p95": {"$ref": "#/$defs/quantity"},
        "app_delay_max": {"$ref": "#/$defs/quantity"},
        "events": {
          "type": "array",
          "items": {
            "type": "object",
            "additionalProperties": false,
            "required": ["kind", "t_wall", "t_since_t0", "detail"],
            "properties": {
              "kind": {"type": "string", "minLength": 1},
              "t_wall": {"$ref": "#/$defs/utc"},
              "t_since_t0": {"$ref": "#/$defs/quantity"},
              "detail": {"type": ["string", "null"]}
            }
          }
        }
      }
    },
    "tracks": {
      "type": "array",
      "items": {
        "type": "object",
        "additionalProperties": false,
        "required": [
          "track_id", "first_seen", "last_seen", "visible", "n_samples",
          "median_sample_interval", "n_valid_intervals", "n_gaps_excluded", "gap_time",
          "valid_time", "path_length", "mean_speed", "max_speed", "activity", "short"
        ],
        "properties": {
          "track_id": {"type": "integer", "minimum": 0},
          "first_seen": {"$ref": "#/$defs/quantity"},
          "last_seen": {"$ref": "#/$defs/quantity"},
          "visible": {"$ref": "#/$defs/quantity"},
          "n_samples": {"type": "integer", "minimum": 1},
          "median_sample_interval": {"$ref": "#/$defs/quantity"},
          "n_valid_intervals": {"type": "integer", "minimum": 0},
          "n_gaps_excluded": {"type": "integer", "minimum": 0},
          "gap_time": {"$ref": "#/$defs/quantity"},
          "valid_time": {"$ref": "#/$defs/quantity"},
          "path_length": {"$ref": "#/$defs/quantity"},
          "mean_speed": {"$ref": "#/$defs/quantity"},
          "max_speed": {"$ref": "#/$defs/quantity"},
          "activity": {
            "type": "object",
            "additionalProperties": false,
            "required": ["stationary", "walking", "running"],
            "properties": {
              "stationary": {"$ref": "#/$defs/quantity"},
              "walking": {"$ref": "#/$defs/quantity"},
              "running": {"$ref": "#/$defs/quantity"}
            }
          },
          "short": {"type": "boolean"}
        }
      }
    },
    "caveats": {"type": "array", "items": {"type": "string", "minLength": 1}, "minItems": 1}
  },
  "$defs": {
    "uuid4": {
      "type": "string",
      "pattern": "^[0-9a-f]{8}-[0-9a-f]{4}-4[0-9a-f]{3}-[89ab][0-9a-f]{3}-[0-9a-f]{12}$"
    },
    "utc": {
      "type": "string",
      "pattern": "^\\d{4}-\\d{2}-\\d{2}T\\d{2}:\\d{2}:\\d{2}(\\.\\d+)?Z$"
    },
    "quantity": {
      "type": "object",
      "additionalProperties": false,
      "required": ["value", "unit"],
      "properties": {
        "value": {"type": ["number", "null"]},
        "unit": {"type": "string", "minLength": 1},
        "reason": {"type": "string", "minLength": 1}
      },
      "if": {"properties": {"value": {"type": "null"}}},
      "then": {"required": ["reason"]},
      "else": {"not": {"required": ["reason"]}}
    }
  }
}
